{
  "schemaVersion": 1,
  "id": "ff6-screen-reader",
  "status": "active",
  "gameIds": [
    "final-fantasy-vi"
  ],
  "name": "FF6 Screen Reader",
  "framework": "MelonLoader (C#)",
  "homeUrl": "https://github.com/BlindGuyNW/FF6ScreenReader",
  "releaseSource": {
    "kind": "github",
    "repositoryUrl": "https://github.com/BlindGuyNW/FF6ScreenReader"
  },
  "links": []
}
